{
  "schema_version": "1.0.0",
  "vocabulary_version": "v1.6.0",
  "status": "current_public",
  "terms": [
    {
      "public_topic_id": "GRW-TOP-001",
      "canonical_term": "knowledge-governance",
      "chinese_explanation": "知识与来源治理",
      "definition": "Governance of source, derivative, ownership, boundary, and review claims in a controlled workflow.",
      "scope_note": "Root topic for public guidance about governed source and knowledge work.",
      "exclusions": "Does not establish access, truth, currentness, approval, or authority.",
      "permitted_aliases": [],
      "broader_topic_id": null,
      "term_status": "accepted",
      "introduced_in": "v1.6.0",
      "deprecated_by": null
    },
    {
      "public_topic_id": "GRW-TOP-002",
      "canonical_term": "source-admission",
      "chinese_explanation": "来源准入",
      "definition": "A bounded decision about whether a named source or object may enter a controlled workflow.",
      "scope_note": "Use for identity, ownership, rights, or selection boundaries before handling content.",
      "exclusions": "Does not grant access, copying, redistribution, or use rights.",
      "permitted_aliases": [],
      "broader_topic_id": "GRW-TOP-001",
      "term_status": "accepted",
      "introduced_in": "v1.6.0",
      "deprecated_by": null
    },
    {
      "public_topic_id": "GRW-TOP-003",
      "canonical_term": "source-ownership-and-rights",
      "chinese_explanation": "来源所有权与权利",
      "definition": "Accountability, ownership, restrictions, and rights conditions associated with a source or derivative.",
      "scope_note": "Use when permitted transformation or sharing depends on ownership and rights review.",
      "exclusions": "Does not establish institutional permission or a license conclusion.",
      "permitted_aliases": [],
      "broader_topic_id": "GRW-TOP-001",
      "term_status": "accepted",
      "introduced_in": "v1.6.0",
      "deprecated_by": null
    },
    {
      "public_topic_id": "GRW-TOP-004",
      "canonical_term": "metadata-boundary",
      "chinese_explanation": "元数据边界",
      "definition": "The boundary between a bounded metadata representation and source content or restricted locator details.",
      "scope_note": "Use for inventories, pointers, and descriptions that must not expose or substitute for content.",
      "exclusions": "Does not prove that a target is current, accessible, complete, or suitable.",
      "permitted_aliases": [],
      "broader_topic_id": "GRW-TOP-001",
      "term_status": "accepted",
      "introduced_in": "v1.6.0",
      "deprecated_by": null
    },
    {
      "public_topic_id": "GRW-TOP-005",
      "canonical_term": "source-currentness",
      "chinese_explanation": "来源当前性",
      "definition": "A dated, attributable, task-specific assessment of whether a source condition remains current.",
      "scope_note": "Use when recency, freshness, or validity needs explicit evidence and uncertainty.",
      "exclusions": "Does not turn a past check into a standing guarantee.",
      "permitted_aliases": [],
      "broader_topic_id": "GRW-TOP-001",
      "term_status": "accepted",
      "introduced_in": "v1.6.0",
      "deprecated_by": null
    },
    {
      "public_topic_id": "GRW-TOP-006",
      "canonical_term": "derivative-boundary",
      "chinese_explanation": "衍生物边界",
      "definition": "The declared purpose, limitation, and source boundary of a transformed, cleaned, or curated representation.",
      "scope_note": "Use for summaries, cleaned notes, and other derivatives whose meaning and permitted use are limited.",
      "exclusions": "Does not make a derivative equivalent to its source or automatically safe to share.",
      "permitted_aliases": [],
      "broader_topic_id": "GRW-TOP-001",
      "term_status": "accepted",
      "introduced_in": "v1.6.0",
      "deprecated_by": null
    },
    {
      "public_topic_id": "GRW-TOP-007",
      "canonical_term": "accountable-human-review",
      "chinese_explanation": "负责人人类审查",
      "definition": "A visible accountable-human review boundary for interpretation, disposition, and consequential decisions.",
      "scope_note": "Use where an interpretation, readiness, or action decision must remain with a responsible human.",
      "exclusions": "Does not prove that review occurred or that a human decision is correct.",
      "permitted_aliases": [],
      "broader_topic_id": "GRW-TOP-001",
      "term_status": "accepted",
      "introduced_in": "v1.6.0",
      "deprecated_by": null
    },
    {
      "public_topic_id": "GRW-TOP-008",
      "canonical_term": "bounded-retrieval",
      "chinese_explanation": "受限检索",
      "definition": "A retrieval activity with declared inputs, permitted outputs, stop conditions, and excluded actions.",
      "scope_note": "Use for limited retrieval planning, refusal behavior, and declared output boundaries.",
      "exclusions": "Does not authorize network use, credentials, source access, or source-content handling.",
      "permitted_aliases": [],
      "broader_topic_id": "GRW-TOP-001",
      "term_status": "accepted",
      "introduced_in": "v1.6.0",
      "deprecated_by": null
    },
    {
      "public_topic_id": "GRW-TOP-009",
      "canonical_term": "controlled-pilot",
      "chinese_explanation": "受控试点",
      "definition": "A deliberately narrow exercise used to inspect assumptions, boundaries, and refusal behavior.",
      "scope_note": "Use for minimal pilots and dry runs before any proposed expansion.",
      "exclusions": "Does not prove production readiness, scalability, or general support.",
      "permitted_aliases": [],
      "broader_topic_id": "GRW-TOP-001",
      "term_status": "accepted",
      "introduced_in": "v1.6.0",
      "deprecated_by": null
    },
    {
      "public_topic_id": "GRW-TOP-010",
      "canonical_term": "scope-expansion",
      "chinese_explanation": "范围扩张",
      "definition": "A proposed widening of material, object, authority, or operational scope that needs separate evidence and review.",
      "scope_note": "Use when moving from a bounded baseline or pilot to broader work.",
      "exclusions": "Does not make prior success permission for a later phase.",
      "permitted_aliases": [],
      "broader_topic_id": "GRW-TOP-001",
      "term_status": "accepted",
      "introduced_in": "v1.6.0",
      "deprecated_by": null
    },
    {
      "public_topic_id": "GRW-TOP-011",
      "canonical_term": "reproducibility-boundary",
      "chinese_explanation": "可复现性边界",
      "definition": "The declared inputs, outputs, identity conditions, and interpretation limits of a repeatable process.",
      "scope_note": "Use when rebuilding, repeating, or comparing a process without overstating its meaning.",
      "exclusions": "Does not prove equivalence, scientific meaning, compliance, or authority.",
      "permitted_aliases": [],
      "broader_topic_id": "GRW-TOP-001",
      "term_status": "accepted",
      "introduced_in": "v1.6.0",
      "deprecated_by": null
    },
    {
      "public_topic_id": "GRW-TOP-012",
      "canonical_term": "revision-impact",
      "chinese_explanation": "修订影响",
      "definition": "A record of what changed, why it changed, and which downstream material requires re-review.",
      "scope_note": "Use for corrections, stale representations, and controlled maintenance changes.",
      "exclusions": "Does not prove that all downstream effects have been resolved.",
      "permitted_aliases": [],
      "broader_topic_id": "GRW-TOP-001",
      "term_status": "accepted",
      "introduced_in": "v1.6.0",
      "deprecated_by": null
    },
    {
      "public_topic_id": "GRW-TOP-013",
      "canonical_term": "lifecycle-maintenance",
      "chinese_explanation": "生命周期维护",
      "definition": "Controlled maintenance of current, legacy, stale, or closing workflow material across its lifecycle.",
      "scope_note": "Use for route identity, baseline refresh, closure, and maintenance findings.",
      "exclusions": "Does not establish a release, installation, or standing permission.",
      "permitted_aliases": [],
      "broader_topic_id": "GRW-TOP-001",
      "term_status": "accepted",
      "introduced_in": "v1.6.0",
      "deprecated_by": null
    },
    {
      "public_topic_id": "GRW-TOP-014",
      "canonical_term": "capability-stabilization",
      "chinese_explanation": "能力稳定化",
      "definition": "Resolution of known defects, classification questions, and maintainability concerns before new scope is added.",
      "scope_note": "Use for consolidating a core bundle or source family before broadening work.",
      "exclusions": "Does not guarantee future compatibility or general support.",
      "permitted_aliases": [],
      "broader_topic_id": "GRW-TOP-001",
      "term_status": "accepted",
      "introduced_in": "v1.6.0",
      "deprecated_by": null
    },
    {
      "public_topic_id": "GRW-TOP-015",
      "canonical_term": "public-material-boundary",
      "chinese_explanation": "公开材料边界",
      "definition": "The boundary between a public-safe derivative and material that must remain non-public or separately reviewed.",
      "scope_note": "Use when preparing public guidance, cards, or other material intended for distribution.",
      "exclusions": "Does not establish publication permission, de-identification sufficiency, or a rights conclusion.",
      "permitted_aliases": [],
      "broader_topic_id": "GRW-TOP-001",
      "term_status": "accepted",
      "introduced_in": "v1.6.0",
      "deprecated_by": null
    }
  ]
}
